{
  "estado": "REQUIERE_DATOS",
  "consulta_id": "REAL-ANON-001",
  "confianza": 0.96,
  "datos_faltantes": [
    "fecha_preferida",
    "horario_preferido",
    "cantidad_ninos",
    "cantidad_de_cumpleanieros"
  ],
  "paquete_recomendado": {
    "nombre": "Completa",
    "justificacion": "Es una recomendación preliminar porque la familia busca una solución integral y no quiere ocuparse de la organización; debe confirmarse cuando se conozca la cantidad de niños y si festejan uno o varios niños."
  },
  "alternativa": null,
  "cotizacion": {
    "moneda": "ARS",
    "catalogo_validado": false,
    "vigencia": null,
    "tipo_dia": null,
    "items": [],
    "conceptos_pendientes": [
      "Fecha y tipo de día",
      "Cantidad de niños"
    ],
    "total_estimado": null
  },
  "alertas": [
    "No cotizar hasta conocer la cantidad total de niños",
    "Confirmar si festejan uno o varios niños",
    "Precios disponibles solo para diciembre de 2026; falta determinar fecha y tipo de día",
    "Disponibilidad pendiente"
  ],
  "mensaje_whatsapp": "Hola. Para preparar una propuesta integral necesitamos confirmar cuántos niños participarían, si el festejo es para uno o varios cumpleañeros, y la fecha y horario preferidos. Con esos datos podremos recomendar la opción más adecuada para las cinco familias. La disponibilidad, los valores y las condiciones serán confirmados por el equipo.",
  "resumen_interno": {
    "adultos": 35,
    "ninos": "Pendiente",
    "edad": 5,
    "tipo_evento": "Cumpleaños conjunto con cinco familias",
    "prioridad": "Solución integral",
    "proximo_paso": "Solicitar cantidad de niños, cantidad de cumpleañeros, fecha y horario"
  },
  "requiere_revision_humana": true,
  "motivos_revision": [
    "Completar datos esenciales",
    "Validar capacidad",
    "Solicitar precios vigentes",
    "Confirmar disponibilidad"
  ]
}
